{
  "script_id": "3-free-ai-writing-tools-for-novelists",
  "title": "How to Pick a Genuinely Free AI Writing Tool (Novelists)",
  "language": "en",
  "keyword": "best free ai writing tools for novelists",
  "target_seconds": 75,
  "sections": [
    {
      "role": "hook",
      "title": "Hook",
      "narration": "Most so-called free AI writing tools for novelists are just trials in disguise. Here's how to spot the ones that are actually free, and actually useful.",
      "visual": "Hard cut, text on screen: \"FREE?\" with a strikethrough."
    },
    {
      "role": "intro",
      "title": "Why it matters",
      "narration": "If you're drafting a novel on a budget, the right free tool saves you real hours. The wrong one quietly locks your finished manuscript behind a paywall, right when you hit your stride.",
      "visual": "B-roll: someone typing, then a paywall modal slides up."
    },
    {
      "role": "segment",
      "title": "1. A real free tier",
      "narration": "First, look for a genuine free tier, not a seven-day trial. A real free tier lets you draft, edit, and export your work without ever entering a card number.",
      "visual": "Screen recording: a pricing page; highlight the free column."
    },
    {
      "role": "segment",
      "title": "2. Who owns your words",
      "narration": "Second, check who owns your words. Read the terms: a good tool keeps your manuscript yours and lets you export clean text any time you like, in a normal format like Word or plain text.",
      "visual": "Zoom on a terms-of-service line about content ownership and export."
    },
    {
      "role": "segment",
      "title": "3. The word limits",
      "narration": "Third, watch the word limits. Many free plans cap how much AI text you can generate each month, so match the cap to how fast you actually write.",
      "visual": "Simple bar: monthly cap vs. your typical word count."
    },
    {
      "role": "cta",
      "title": "Call to action",
      "narration": "I put the full shortlist, with each tool's real free-tier limits, in the description. Grab it, and subscribe if you want the no-hype tool reviews.",
      "visual": "End card: subscribe button + link to the blog article."
    }
  ]
}
